{"range":{"start":126,"end":150},"chunks":[{"start_page":126,"end_page":128,"context_start_page":125,"context_end_page":129},{"start_page":129,"end_page":131,"context_start_page":128,"context_end_page":132},{"start_page":132,"end_page":134,"context_start_page":131,"context_end_page":135},{"start_page":135,"end_page":137,"context_start_page":134,"context_end_page":138},{"start_page":138,"end_page":140,"context_start_page":137,"context_end_page":141},{"start_page":141,"end_page":143,"context_start_page":140,"context_end_page":144},{"start_page":144,"end_page":146,"context_start_page":143,"context_end_page":147},{"start_page":147,"end_page":149,"context_start_page":146,"context_end_page":150},{"start_page":150,"end_page":150,"context_start_page":149,"context_end_page":151}],"entries":[{"kind":"poem","title":"","subtitle":"","author":"","form":"七言絕句","heading_level":null,"series":null,"lines":["嬌癡稚女最關情。","新讀毛詩一半生。","忍死看他成長去，","喘絲親訓兩三聲。"],"prose":"","notes":[{"position":{"field":"lines","line":1,"offset":7},"text":"元稹詩：嬌癡稚女繞床行。"},{"position":{"field":"lines","line":2,"offset":4},"text":"《漢書·儒林傳》：毛公治《詩》，為獻王博士。杜荀鶴詩：歸同弟姪讀生書。"},{"position":{"field":"lines","line":3,"offset":2},"text":"《晉書·宣帝紀》：我忍死待君。"}],"source_pages":[126],"confidence":0.86,"boundary_state":"closed","continues_previous":true},{"kind":"poem","title":"","subtitle":"","author":"","form":"七言絕句","heading_level":null,"series":null,"lines":["湯藥親嘗子婦該。","雲泥懸絕事堪哀。","自知病骨輕如草，","莫望尚書嫁女來。"],"prose":"","notes":[{"position":{"field":"lines","line":2,"offset":2},"text":"白居易詩：昔年洛陽社，貧賤相提擕；今年長安道，對面隔雲泥。"},{"position":{"field":"lines","line":3,"offset":7},"text":"蘇軾詩：病骨煩支持。"}],"source_pages":[126],"confidence":0.86,"boundary_state":"closed","continues_previous":false},{"kind":"poem","title":"","subtitle":"","author":"","form":"七言絕句","heading_level":null,"series":null,"lines":["更無兄妹與差肩。","孤負劬勞阿母憐。","囑向薄情狂壻道，","為加恭敬倍從前。"],"prose":"","notes":[{"position":{"field":"lines","line":3,"offset":1},"text":"一作「付」。"}],"source_pages":[126],"confidence":0.82,"boundary_state":"closed","continues_previous":false},{"kind":"poem","title":"","subtitle":"","author":"","form":"七言絕句","heading_level":null,"series":null,"lines":["謝絕妖巫罷禱祈。","不將牲命媚神祗。","刻肌冤苦傷心痛，","病者年來細得知。"],"prose":"","notes":[{"position":{"field":"lines","line":1,"offset":7},"text":"張衡賦：湯蠲體以禱祈兮。"}],"source_pages":[126],"confidence":0.83,"boundary_state":"closed","continues_previous":false},{"kind":"poem","title":"","subtitle":"","author":"","form":"七言絕句","heading_level":null,"series":null,"lines":["前路無涯愛有涯。","一心趨向妙蓮花。","眼前眷屬休悲戀，","九品同生也一家。"],"prose":"","notes":[{"position":{"field":"lines","line":1,"offset":4},"text":"《莊子》：吾生也有涯，而知也無涯。"},{"position":{"field":"lines","line":4,"offset":2},"text":"《觀無量壽佛經》：往生極樂世界者，分上中下三輩，輩分上中下三品，謂之三輩九品。"}],"source_pages":[126,127],"confidence":0.86,"boundary_state":"closed","continues_previous":false},{"kind":"poem","title":"無題","subtitle":"","author":"","form":"七言律詩","heading_level":null,"series":null,"lines":["眉萼慵描出內稀。","試晴風日浣羅衣。","雪融香跡重臺樣，","春減裙腰尺六圍。","隨意梳勻都韻事，","不形顰笑總沈機。","無端午睡醒來晚，","驚認殘陽作曙暉。"],"prose":"","notes":[{"position":{"field":"lines","line":2,"offset":7},"text":"王維《西施咏》：邀人傅香粉，不自着羅衣。"},{"position":{"field":"lines","line":3,"offset":7},"text":"元稹《夢游春》詩：金蹙重臺履。"},{"position":{"field":"lines","line":4,"offset":7},"text":"注見卷一。"},{"position":{"field":"lines","line":6,"offset":7},"text":"《後漢書·光武傳贊》：沈機先物。"},{"position":{"field":"lines","line":7,"offset":7},"text":"朱淑真詩：正是午窗初睡醒。"},{"position":{"field":"lines","line":8,"offset":7},"text":"岑參詩：西掖晴雲捧曙輝。"}],"source_pages":[127],"confidence":0.9,"boundary_state":"closed","continues_previous":false},{"kind":"poem","title":"花下","subtitle":"","author":"","form":"七言絕句","heading_level":null,"series":null,"lines":["未必春工一夕移。","杏花清減夜來姿。","可知顏色關人處，","正在紅消欲白時。"],"prose":"","notes":[],"source_pages":[127],"confidence":0.93,"boundary_state":"closed","continues_previous":false},{"kind":"heading","title":"疑雨集註卷二","subtitle":"","author":"","form":"","heading_level":1,"series":null,"lines":[],"prose":"","notes":[],"source_pages":[128],"confidence":0.7,"boundary_state":"closed","continues_previous":false},{"kind":"poem","title":"","subtitle":"","author":"","form":"七言絕句","heading_level":null,"series":null,"lines":["一寸丹心皦日同。","薄情猶自認朦朧。","無由披膈教君見，","想殺秦宮照胆銅。"],"prose":"","notes":[{"position":{"field":"lines","line":1,"offset":7},"text":"《詩》：謂予不信，有如皦日。"},{"position":{"field":"lines","line":3,"offset":7},"text":"「君」一作「郎」。"},{"position":{"field":"lines","line":4,"offset":7},"text":"《西京雜記》：高祖入咸陽宮，見方鏡，高五尺九寸，表裏通明；人來照之，影則倒見；以手捫心，則見腸胃五臟。"}],"source_pages":[128],"confidence":0.86,"boundary_state":"closed","continues_previous":false},{"kind":"poem","title":"晴日偕同人有見","subtitle":"","author":"","form":"七言律詩","heading_level":null,"series":null,"lines":["風喧日冷正佳辰。","綠淨園南韭葉春。","狂社乍閑浮白手，","嚴閨初放踏青人。","故嗔平視遮生客，","暗記微詞識近鄰。","臨去更憐低樹好，","遶枝閒看兩三巡。"],"prose":"","notes":[{"position":{"field":"lines","line":1,"offset":7},"text":"杜甫《小寒食舟中作》：佳辰強飲食猶寒。"},{"position":{"field":"lines","line":2,"offset":7},"text":"《南史·周顒傳》：春初早韭。"},{"position":{"field":"lines","line":3,"offset":7},"text":"《說苑》：魏文侯與大夫飲酒，公乘不仁為觴政，曰飲不盡者浮一大白。"},{"position":{"field":"lines","line":4,"offset":7},"text":"《千金月令》：三月三日上踏青鞋襪。鄭谷詩：雨後江頭且踏青。"},{"position":{"field":"lines","line":5,"offset":1},"text":"一作「佯」。"},{"position":{"field":"lines","line":5,"offset":7},"text":"《魏畧》：世子丕宴諸文學，酒酣命甄姬出拜，衆皆俯，劉楨獨平視。"},{"position":{"field":"lines","line":6,"offset":7},"text":"宋玉《好色賦》：口多微詞。"},{"position":{"field":"lines","line":7,"offset":7},"text":"秦韜玉詩：誰家促席臨低樹。"}],"source_pages":[128,129],"confidence":0.86,"boundary_state":"closed","continues_previous":false},{"kind":"poem","title":"踏春詞偕雲客孝先韜仲作","subtitle":"","author":"","form":"五言排律","heading_level":null,"series":null,"lines":["女伴相呼早，","春寒嬾下床。","檀郎侍梳洗，","阿母檢衣裳。","愛影頻看鏡，","迴身蹔進房。","偶因裙帶換，","忘却紫羅囊。","何必花堪賞，","平蕪綠可憐。","香輪逢鄭袖，","金彈逐韓嫣。","船近桃根泊，","裙來柳下湔。","自緣愁緒亂，","風景惡相牽。","小徑橫斜去，","經過綠水園。","園丁勞指點，","隣女喜寒暄。","薄雪凝陰榭，","低枝壓短垣。","同行莫攀折，","贏得糝衣繁。","何處堪携手，","南塘碧樹邊。","有心同皎日，","無胆似非煙。","暗影烏龍覺，","乖音鴆鳥傳。","匆匆陳不盡，","當面付紅箋。","孀艷松篁恨，","哭重泉聽得無。","野風吹縞袂，","墳草濺啼珠。","出郭初迷路，","回房定向隅。","傷心螻蟻穴，","命薄不前驅。"],"prose":"","notes":[{"position":{"field":"title","line":null,"offset":0},"text":"題名及分首據 P129-P131 版面判讀。"},{"position":{"field":"lines","line":3,"offset":2},"text":"李商隱詩：今朝歌管屬檀郎。"},{"position":{"field":"lines","line":8,"offset":5},"text":"《世說》：謝遏好著紫羅香囊。"},{"position":{"field":"lines","line":10,"offset":5},"text":"杜牧詩：回首是平蕪。"},{"position":{"field":"lines","line":11,"offset":5},"text":"鄭谷《春草》詩：香輪莫碾青青破。《史記·楚世家》：楚王幸姬鄭袖。"},{"position":{"field":"lines","line":12,"offset":5},"text":"《西京雜記》：韓嫣好彈，常以金為丸。"},{"position":{"field":"lines","line":16,"offset":5},"text":"賈至詩：舞蝶縈愁緒。"},{"position":{"field":"lines","line":18,"offset":5},"text":"杜甫詩：名園依綠水。"},{"position":{"field":"lines","line":19,"offset":5},"text":"陸游詩：園丁報花折。"},{"position":{"field":"lines","line":21,"offset":3},"text":"一作「花」。"},{"position":{"field":"lines","line":22,"offset":5},"text":"《左傳》：子有短垣，而自踰之。"},{"position":{"field":"lines","line":27,"offset":5},"text":"唐皇甫枚《步非煙傳》：臨淮武公業愛妾曰非煙，姓步氏。"},{"position":{"field":"lines","line":29,"offset":5},"text":"《搜神後記》：會稽民張然養狗名烏龍。"},{"position":{"field":"lines","line":30,"offset":5},"text":"《楚辭》：我欲請鴆鳥為媒兮，鴆告予以不好。"},{"position":{"field":"lines","line":32,"offset":5},"text":"韓偓詩：小疊紅箋書恨字。"}],"source_pages":[129,130,131],"confidence":0.74,"boundary_state":"closed","continues_previous":false},{"kind":"poem","title":"","subtitle":"","author":"","form":"五言排律","heading_level":null,"series":null,"lines":["畫壁前朝寺，","陰森夾徑松。","偶來雙騎白，","時度一衫紅。","脫釧供香像，","懸旛繡毒龍。","那堪歌舞席，","近在講堂東。","風日薰南浦，","瑟瑟波。","被留青翰宿，","香特博山過。","幽意春前積，","佳遊水上多。","從來悲喜併，","牛女在明河。","鷁鵪斜飛處，","雲陰日半塘。","漁郎歌倚棹，","蠶妾笑提筐。","鬢溼篸花露，","裙沾鬥草香。","同行暫猶好，","歸路莫嫌長。"],"prose":"","notes":[{"position":{"field":"lines","line":1,"offset":5},"text":"《長安志》：嘉猷觀中精思院，王維、鄭虔、吳道子皆有畫壁。"},{"position":{"field":"lines","line":2,"offset":5},"text":"《梁書·張充傳》：松柏森陰。溫庭筠詩：畫壁森陰九子堂。"},{"position":{"field":"lines","line":5,"offset":5},"text":"《名山記》：五龍宮有沈香像。"},{"position":{"field":"lines","line":6,"offset":5},"text":"王維詩：安禪制毒龍。"},{"position":{"field":"lines","line":8,"offset":5},"text":"沈炯詩：鷲嶺三層塔，庵園一講堂。"},{"position":{"field":"lines","line":9,"offset":5},"text":"江淹《別賦》：送君南浦。"},{"position":{"field":"lines","line":10,"offset":3},"text":"白居易詩：水面風驅瑟瑟波。"},{"position":{"field":"lines","line":11,"offset":5},"text":"《說苑》：鄂君乘青翰之舟，越人擁楫而歌，鄂君舉繡被而覆之。"},{"position":{"field":"lines","line":12,"offset":5},"text":"李商隱《柳枝詩序》：三日當去，賤裙水上，以博山香待，與郎俱過。"},{"position":{"field":"lines","line":13,"offset":5},"text":"盧仝《秋夢行》：中含幽意兩不宣。"},{"position":{"field":"lines","line":14,"offset":5},"text":"張說詩：漢苑佳遊地。"},{"position":{"field":"lines","line":16,"offset":5},"text":"《齊諧記》：七月七日織女渡河詣牽牛。"},{"position":{"field":"lines","line":17,"offset":5},"text":"《爾雅翼》：鷁鵪亦鴛鴦之類，其色多紫。"},{"position":{"field":"lines","line":20,"offset":4},"text":"一作「携」。"}],"source_pages":[131,132],"confidence":0.62,"boundary_state":"closed","continues_previous":false},{"kind":"poem","title":"","subtitle":"","author":"","form":"七言律詩","heading_level":null,"series":null,"lines":["卸却吳綾重寬衫。","奈瘦何。","偶隨啼鳥聽，","竟踏落花過。","瑪瑙春雲寺，","胭脂夕照坡。","畫船何處去，","煙外響吳歌。"],"prose":"","notes":[{"position":{"field":"lines","line":1,"offset":7},"text":"李商隱詩：春衫瘦着寬。"},{"position":{"field":"lines","line":3,"offset":5},"text":"一作「遠」。"},{"position":{"field":"lines","line":5,"offset":7},"text":"《武林舊事》：瑪瑙坡在孤山路。"},{"position":{"field":"lines","line":6,"offset":7},"text":"蘇軾詩：貂裘夜走胭脂坡。"},{"position":{"field":"lines","line":7,"offset":7},"text":"范成大詩：細雨垂楊繫畫船。"}],"source_pages":[132],"confidence":0.55,"boundary_state":"closed","continues_previous":false},{"kind":"poem","title":"","subtitle":"","author":"","form":"七言律詩","heading_level":null,"series":null,"lines":["鎖鑰嚴城早。","難拚是夕暉。","水心初漾漾，","樓角更依依。","蹋鞠爭先入，","胡琴落後歸。","不妨南市過，","月下獨來稀。"],"prose":"","notes":[{"position":{"field":"lines","line":1,"offset":5},"text":"韋應物詩：嚴城動寒角。"},{"position":{"field":"lines","line":2,"offset":4},"text":"一作「落暉」。"},{"position":{"field":"lines","line":5,"offset":5},"